[{"degreeType":"学硕","s100A":45,"s100B":42,"s150A":68,"s150B":63,"totalA":323,"totalB":313,"year":2023,"category":"哲学","sourceUrl":"https://yz.chsi.com.cn/kyzx/kydt/202303/20230310/2265487748.html"},{"degreeType":"学硕","s100A":48,"s100B":45,"s150A":72,"s150B":68,"totalA":346,"totalB":336,"year":2023,"category":"经济学","sourceUrl":"https://yz.chsi.com.cn/kyzx/kydt/202303/20230310/2265487748.html"},{"degreeType":"学硕","s100A":45,"s100B":42,"s150A":68,"s150B":63,"totalA":326,"totalB":316,"year":2023,"category":"法学","sourceUrl":"https://yz.chsi.com.cn/kyzx/kydt/202303/20230310/2265487748.html"},{"degreeType":"学硕","s100A":51,"s100B":48,"s150A":153,"s150B":144,"totalA":350,"totalB":340,"year":2023,"category":"教育学","sub":"不含体育学","sourceUrl":"https://yz.chsi.com.cn/kyzx/kydt/202303/20230310/2265487748.html"},{"degreeType":"学硕","s100A":39,"s100B":36,"s150A":117,"s150B":108,"totalA":305,"totalB":295,"year":2023,"category":"教育学","sub":"体育学","sourceUrl":"https://yz.chsi.com.cn/kyzx/kydt/202303/20230310/2265487748.html"},{"degreeType":"学硕","s100A":54,"s100B":51,"s150A":81,"s150B":77,"totalA":363,"totalB":353,"year":2023,"category":"文学","sourceUrl":"https://yz.chsi.com.cn/kyzx/kydt/202303/20230310/2265487748.html"},{"degreeType":"学硕","s100A":46,"s100B":43,"s150A":138,"s150B":129,"totalA":336,"totalB":326,"year":2023,"category":"历史学","sourceUrl":"https://yz.chsi.com.cn/kyzx/kydt/202303/20230310/2265487748.html"},{"degreeType":"学硕","s100A":38,"s100B":35,"s150A":57,"s150B":53,"totalA":279,"totalB":269,"year":2023,"category":"理学","sourceUrl":"https://yz.chsi.com.cn/kyzx/kydt/202303/20230310/2265487748.html"},{"degreeType":"学硕","s100A":38,"s100B":35,"s150A":57,"s150B":53,"totalA":273,"totalB":263,"year":2023,"category":"工学","sub":"不含照顾专业","sourceUrl":"https://yz.chsi.com.cn/kyzx/kydt/202303/20230310/2265487748.html"},{"degreeType":"学硕","s100A":35,"s100B":32,"s150A":53,"s150B":48,"totalA":260,"totalB":250,"year":2023,"category":"工学","sub":"照顾专业","sourceUrl":"https://yz.chsi.com.cn/kyzx/kydt/202303/20230310/2265487748.html"},{"degreeType":"学硕","s100A":33,"s100B":30,"s150A":50,"s150B":45,"totalA":251,"totalB":241,"year":2023,"category":"农学","sourceUrl":"https://yz.chsi.com.cn/kyzx/kydt/202303/20230310/2265487748.html"},{"degreeType":"学硕","s100A":39,"s100B":36,"s150A":117,"s150B":108,"totalA":296,"totalB":286,"year":2023,"category":"医学","sub":"不含中医类照顾专业","sourceUrl":"https://yz.chsi.com.cn/kyzx/kydt/202303/20230310/2265487748.html"},{"degreeType":"学硕","s100A":39,"s100B":36,"s150A":117,"s150B":108,"totalA":295,"totalB":285,"year":2023,"category":"医学","sub":"中医类照顾专业","sourceUrl":"https://yz.chsi.com.cn/kyzx/kydt/202303/20230310/2265487748.html"},{"degreeType":"学硕","s100A":35,"s100B":32,"s150A":53,"s150B":48,"totalA":260,"totalB":250,"year":2023,"category":"军事学","sourceUrl":"https://yz.chsi.com.cn/kyzx/kydt/202303/20230310/2265487748.html"},{"degreeType":"学硕","s100A":47,"s100B":44,"s150A":71,"s150B":66,"totalA":340,"totalB":330,"year":2023,"category":"管理学","sourceUrl":"https://yz.chsi.com.cn/kyzx/kydt/202303/20230310/2265487748.html"},{"degreeType":"学硕","s100A":40,"s100B":37,"s150A":60,"s150B":56,"totalA":362,"totalB":352,"year":2023,"category":"艺术学","sourceUrl":"https://yz.chsi.com.cn/kyzx/kydt/202303/20230310/2265487748.html"},{"degreeType":"学硕","s100A":36,"s100B":33,"s150A":54,"s150B":50,"totalA":265,"totalB":255,"year":2023,"category":"交叉学科","sourceUrl":"https://yz.chsi.com.cn/kyzx/kydt/202303/20230310/2265487748.html"},{"degreeType":"专硕","s100A":45,"s100B":42,"s150A":68,"s150B":63,"totalA":326,"totalB":316,"year":2023,"category":"法律·社工·警务","sub":"法律(非法学/法学)、社会工作、警务","sourceUrl":"https://yz.chsi.com.cn/kyzx/kydt/202303/20230310/2265487748.html"},{"degreeType":"专硕","s100A":51,"s100B":48,"s150A":77,"s150B":72,"totalA":350,"totalB":340,"year":2023,"category":"教育·汉硕","sub":"教育、汉语国际教育","sourceUrl":"https://yz.chsi.com.cn/kyzx/kydt/202303/20230310/2265487748.html"},{"degreeType":"专硕","s100A":51,"s100B":48,"s150A":153,"s150B":144,"totalA":350,"totalB":340,"year":2023,"category":"应用心理","sourceUrl":"https://yz.chsi.com.cn/kyzx/kydt/202303/20230310/2265487748.html"},{"degreeType":"专硕","s100A":39,"s100B":36,"s150A":117,"s150B":108,"totalA":305,"totalB":295,"year":2023,"category":"体育","sourceUrl":"https://yz.chsi.com.cn/kyzx/kydt/202303/20230310/2265487748.html"},{"degreeType":"专硕","s100A":54,"s100B":51,"s150A":81,"s150B":77,"totalA":363,"totalB":353,"year":2023,"category":"翻译·新闻·出版","sourceUrl":"https://yz.chsi.com.cn/kyzx/kydt/202303/20230310/2265487748.html"},{"degreeType":"专硕","s100A":46,"s100B":43,"s150A":138,"s150B":129,"totalA":336,"totalB":326,"year":2023,"category":"文物与博物馆","sourceUrl":"https://yz.chsi.com.cn/kyzx/kydt/202303/20230310/2265487748.html"},{"degreeType":"专硕","s100A":38,"s100B":35,"s150A":57,"s150B":53,"totalA":273,"totalB":263,"year":2023,"category":"工科专硕","sub":"建筑/电子信息/机械/材料与化工/资源与环境/能源动力/土木水利/生物与医药/交通运输","sourceUrl":"https://yz.chsi.com.cn/kyzx/kydt/202303/20230310/2265487748.html"},{"degreeType":"专硕","s100A":33,"s100B":30,"s150A":50,"s150B":45,"totalA":251,"totalB":241,"year":2023,"category":"农科专硕","sub":"农业、兽医、风景园林、林业","sourceUrl":"https://yz.chsi.com.cn/kyzx/kydt/202303/20230310/2265487748.html"},{"degreeType":"专硕","s100A":39,"s100B":36,"s150A":117,"s150B":108,"totalA":296,"totalB":286,"year":2023,"category":"临床·口腔·公卫","sub":"临床医学、口腔医学、公共卫生、护理、药学、中药学","sourceUrl":"https://yz.chsi.com.cn/kyzx/kydt/202303/20230310/2265487748.html"},{"degreeType":"专硕","s100A":39,"s100B":36,"s150A":117,"s150B":108,"totalA":295,"totalB":285,"year":2023,"category":"中医","sourceUrl":"https://yz.chsi.com.cn/kyzx/kydt/202303/20230310/2265487748.html"},{"degreeType":"专硕","s100A":35,"s100B":32,"s150A":53,"s150B":48,"totalA":260,"totalB":250,"year":2023,"category":"军事","sourceUrl":"https://yz.chsi.com.cn/kyzx/kydt/202303/20230310/2265487748.html"},{"degreeType":"专硕","s100A":41,"s100B":36,"s150A":82,"s150B":72,"totalA":167,"totalB":157,"year":2023,"category":"工商管理·旅游管理","sourceUrl":"https://yz.chsi.com.cn/kyzx/kydt/202303/20230310/2265487748.html"},{"degreeType":"专硕","s100A":44,"s100B":39,"s150A":88,"s150B":78,"totalA":175,"totalB":165,"year":2023,"category":"公共管理","sourceUrl":"https://yz.chsi.com.cn/kyzx/kydt/202303/20230310/2265487748.html"},{"degreeType":"专硕","s100A":51,"s100B":46,"s150A":102,"s150B":92,"totalA":197,"totalB":187,"year":2023,"category":"会计","sourceUrl":"https://yz.chsi.com.cn/kyzx/kydt/202303/20230310/2265487748.html"},{"degreeType":"专硕","s100A":51,"s100B":46,"s150A":102,"s150B":92,"totalA":197,"totalB":187,"year":2023,"category":"审计","sourceUrl":"https://yz.chsi.com.cn/kyzx/kydt/202303/20230310/2265487748.html"},{"degreeType":"专硕","s100A":52,"s100B":47,"s150A":104,"s150B":94,"totalA":198,"totalB":188,"year":2023,"category":"图书情报","sourceUrl":"https://yz.chsi.com.cn/kyzx/kydt/202303/20230310/2265487748.html"},{"degreeType":"专硕","s100A":44,"s100B":39,"s150A":88,"s150B":78,"totalA":178,"totalB":168,"year":2023,"category":"工程管理","sourceUrl":"https://yz.chsi.com.cn/kyzx/kydt/202303/20230310/2265487748.html"},{"degreeType":"专硕","s100A":40,"s100B":37,"s150A":60,"s150B":56,"totalA":362,"totalB":352,"year":2023,"category":"艺术","sourceUrl":"https://yz.chsi.com.cn/kyzx/kydt/202303/20230310/2265487748.html"},{"degreeType":"统一","s100A":47,"s100B":44,"s150A":71,"s150B":66,"totalA":333,"totalB":323,"year":2024,"category":"哲学","sourceUrl":"https://yz.chsi.com.cn/kyzx/kydt/202403/20240312/2293269479.html"},{"degreeType":"统一","s100A":47,"s100B":44,"s150A":71,"s150B":66,"totalA":338,"totalB":328,"year":2024,"category":"经济学","sourceUrl":"https://yz.chsi.com.cn/kyzx/kydt/202403/20240312/2293269479.html"},{"degreeType":"统一","s100A":47,"s100B":44,"s150A":71,"s150B":66,"totalA":331,"totalB":321,"year":2024,"category":"法学","sourceUrl":"https://yz.chsi.com.cn/kyzx/kydt/202403/20240312/2293269479.html"},{"degreeType":"统一","s100A":41,"s100B":38,"s150A":123,"s150B":114,"totalA":313,"totalB":303,"year":2024,"category":"教育学","sub":"体育学、体育","sourceUrl":"https://yz.chsi.com.cn/kyzx/kydt/202403/20240312/2293269479.html"},{"degreeType":"统一","s100A":51,"s100B":48,"s150A":77,"s150B":72,"totalA":350,"totalB":340,"year":2024,"category":"教育学","sub":"教育、国际中文教育","sourceUrl":"https://yz.chsi.com.cn/kyzx/kydt/202403/20240312/2293269479.html"},{"degreeType":"统一","s100A":51,"s100B":48,"s150A":153,"s150B":144,"totalA":350,"totalB":340,"year":2024,"category":"教育学","sub":"其他学科专业","sourceUrl":"https://yz.chsi.com.cn/kyzx/kydt/202403/20240312/2293269479.html"},{"degreeType":"统一","s100A":55,"s100B":52,"s150A":83,"s150B":78,"totalA":365,"totalB":355,"year":2024,"category":"文学","sourceUrl":"https://yz.chsi.com.cn/kyzx/kydt/202403/20240312/2293269479.html"},{"degreeType":"统一","s100A":49,"s100B":46,"s150A":147,"s150B":138,"totalA":345,"totalB":335,"year":2024,"category":"历史学","sourceUrl":"https://yz.chsi.com.cn/kyzx/kydt/202403/20240312/2293269479.html"},{"degreeType":"统一","s100A":41,"s100B":38,"s150A":62,"s150B":57,"totalA":288,"totalB":278,"year":2024,"category":"理学","sourceUrl":"https://yz.chsi.com.cn/kyzx/kydt/202403/20240312/2293269479.html"},{"degreeType":"统一","s100A":35,"s100B":32,"s150A":53,"s150B":48,"totalA":260,"totalB":250,"year":2024,"category":"工学","sub":"照顾专业","sourceUrl":"https://yz.chsi.com.cn/kyzx/kydt/202403/20240312/2293269479.html"},{"degreeType":"统一","s100A":37,"s100B":34,"s150A":56,"s150B":51,"totalA":273,"totalB":263,"year":2024,"category":"工学","sub":"其他学科专业","sourceUrl":"https://yz.chsi.com.cn/kyzx/kydt/202403/20240312/2293269479.html"},{"degreeType":"统一","s100A":33,"s100B":30,"s150A":50,"s150B":45,"totalA":251,"totalB":241,"year":2024,"category":"农学","sourceUrl":"https://yz.chsi.com.cn/kyzx/kydt/202403/20240312/2293269479.html"},{"degreeType":"统一","s100A":42,"s100B":39,"s150A":126,"s150B":117,"totalA":303,"totalB":293,"year":2024,"category":"医学","sub":"中医学、中西医结合、中医","sourceUrl":"https://yz.chsi.com.cn/kyzx/kydt/202403/20240312/2293269479.html"},{"degreeType":"统一","s100A":42,"s100B":39,"s150A":126,"s150B":117,"totalA":304,"totalB":294,"year":2024,"category":"医学